Job Title,Company,Job Description,Location,Link
Analytics Engineer,PT AJAIB TTX Solusi (jakarta),"We’ve been experiencing hyper-growth the past year, becoming Indonesia's 7th Unicorn Startup and the first Investment Fintech Unicorn in South East Asia 2,5 years after Ajaib first launched. With the global financial technology market expected to grow gradually, we aim to make stock trading accessible for millennials through our mobile-first approach.  In 2022, we opened our new head office in the Indonesia Stock Exchange Building, and we’re just getting started!The three principles, or what we call as 3DNAs became the foundation and set the guideline for the Magician belief system: Everyone is an owner, Growth Mindset, and A Will to Win.DescriptionAre you passionate about transforming raw data into actionable insights and ensuring data governance? We’re looking for an Analytics Engineer to join our innovative team at Ajaib!Every team has its specialty and uniqueness, and our Technology team is no exception! In addition, our Technology team has its DNA that makes our team different and excels at what they do.Impact Driven: We are driven to create products that not only focus on user experience but also make a social impact as a bigger purpose.Craftsmanship: To us, building a product is an art. We carefully craft every detail of it and ensure we have a strong sense of ownership.Pushing Boundaries: The comfort zone is not a place we want to stay in. We keep innovating to keep our minds sharp.ResponsibilitiesBuild and maintain robust data models to power business metrics.Design and implement data quality checks.Optimize data transformations using DBT and ensure smooth operations in BigQuery.Apply dimensional modeling techniques to build scalable data warehouse solutions.Collaborate with data engineers and business teams to align data infrastructure with business goals.What You’ll Work WithData Modeling & Quality: DBT, BigQueryProgramming Languages & configuration: SQL, Python, YAMLVisualization: MetabaseVersion Control: GitHubRequirementsData Modeling: Experience with designing and implementing dimensional models.SQL: Mastery of SQL for complex queries and performance tuning.Python: Skilled in Python scripting for data transformations and automation.Nice to haveExperience with CI/CD tools like GitHub Actions or Jenkins.Advanced Python programming skills.Semantic Layer: Knowledge of semantic layer tools to make data accessible and meaningful.Data Quality: Hands-on experience for building data quality.",Jakarta Raya,https://www.jobstreet.co.id/id/job/80564510?type=standard&ref=search-standalone
Business Intelligence,Nano Vest,"Advocate data-informed decision-making across business depts.Proactive on ad-hoc/deeper data-investigations or trend-analysis to uncover hidden sources of value within our business, and make recommendations out of it when applicableOwn (create, maintain, monitor) reliable & scalable reports and dashboards across our BI tools (i.e. BigQuery, Tableau, etc)Understand and able to stitch between behavioral & transactional users’ data in doing forecasting & planningSQL (query/mining)Excel / Python / R (processing)Tableau / Looker (visualizing)Fluent in English (more for reading/writing documentations)Have successfully made data-driven impactful recommendations in the past experiences",Indonesia,https://www.jobstreet.co.id/id/job/80655751?type=standard&ref=search-standalone
Senior Data Integration Engineer (KAFKA),Snaphunt,"The OfferWork within a company with a solid track record of successFlexible working optionsJoin a well known brand within FinTechThe JobThe JobThe ideal candidate will be responsible for integrating various systems using Kafka, building monitoring tools, and developing APIs in Python. You will work closely with other engineering teams to design and implement data-driven solutions and ensure optimal performance and reliability of our systems.Responsibilities:Writing reusable, testable, and efficient codeDesign and implementation of low-latency, high-availability, and performant applicationsIntegration of different databases and systems viaKafkaData analyticsIntegration of data storage solutionsThe ProfileThe Ideal CandidateSkills & Qualifications:3+ years of experience as a software developerExpert in Python, with knowledge of at least one Python web framework (such as Django, Flask, FastAPI)Perfect SQL skills (PostgreSQL, MySQL)Good Kafka skills (Connectors, KSQL, etc)Experience with time series and noSQL databases (prometheus, MongoDB)Experience with different data visualization tools (Grafana, Metabase, etc.)Experience with containers (Docker, Docker Swarm, k8s)Familiarity with some ORM (Object Relational Mapper) librariesAble to integrate multiple data sources and databases into one systemUnderstanding of the threading limitations of Python, and multi-process architectureUnderstanding of accessibility and security complianceKnowledge of user authentication and authorization between multiple systems, servers, and environmentsUnderstanding of fundamental design principles behind a scalable applicationFamiliarity with event-driven programming in PythonAble to create database schemas that represent and support business processesStrong unit test and debugging skillsProficient understanding of code versioning tools (Git)Excellent time management and multitasking skillsGood analytical and problem-solving skillsThe EmployerOur client offers you the easiest way to afford what you want and need today. Their brand centers around making shopping and payment processes seamless and convenient. Their customers have diverse lifestyles and are looking to enhance their shopping experiences both online and offline.",Jakarta Raya,https://www.jobstreet.co.id/id/job/80667230?type=standard&ref=search-standalone
Advisory Analytics Consultant Manager,IlmuOne Data,"Job Requirements:Strong educational background in Data Science, Statistics, Mathematics, Computer Science, Economics, or a related field. An advanced degree is a plus.5 –10 years of experience in analytics consulting or a similar role, with a track record of leading projects and managing teams.Proficiency in analytics tools and programming languages such as Python, R, SQL, Tableau, or Power BI.Exceptional communication, problem-solving, and stakeholder management skills.Experience with cloud platforms (e.g., AWS, Azure, Google Cloud) and big data technologies is a bonus.Keys Responsibilities:Collaborate with clients to understand their business objectives, challenges, and analytics needs.Serve as a trusted advisor, providing recommendations on leveraging analytics to drive decision-making and improve performance.Present insights, findings, and actionable strategies to senior stakeholders and executive-level clients.Lead and manage multiple analytics projects simultaneously, ensuring timely delivery and alignment with client expectations.Define project scope, timelines, and deliverables while monitoring performance against objectives.Mitigate risks and resolve project-related issues proactively.Design and implement advanced analytics solutions using statistical models, machine learning, and data visualization techniques.Ensure the accuracy, quality, and relevance of all analytical outputs.Mentor and lead a team of analysts and consultants, fostering professional growth and knowledge sharing.Evaluate team performance and provide constructive feedback.Identify opportunities to expand the analytics practice by introducing new techniques or technologies.Contribute to business development efforts, including proposal writing and presenting analytics capabilities to prospective clients.Work closely with other advisory teams, such as strategy, operations, and technology, to deliver integrated solutions.Collaborate with data engineering teams to ensure data pipelines and architectures support analytics needs.Act as a liaison between technical teams and business stakeholders to ensure alignment.Develop and deliver comprehensive reports, dashboards, and visualizations to convey analytics insights effectively.Maintain thorough documentation of analytics processes, methodologies, and project outcomes.",Jakarta Raya,https://www.jobstreet.co.id/id/job/80702952?type=standard&ref=search-standalone
Data Engineer,PT Graha Karya Informasi,">Data Engineer level Intermediate :1. S1 Teknik Informatika, Iimu Komputer, Sistem Informasi, atau bidang terkait2. Pengalaman Kerja Minimal: 3-5 tahun pengalaman dalam pengembangan dan pengelolaan sistem data.3. Sertifikat : Lebih disukai memiliki sertifikasi terkait data engineering seperti Google Professional Data Engineer, AWS Certified Data Analytics, atau Microsoft Azure Data Engineer Associate atau yang relevan lainnya> Data Engineer level Junior :1. S1 Teknik Informatika, Iimu Komputer, Sistem Informasi, atau bidang terkait2. Pengalaman Kerja Minimal: 0-2 tahun pengalaman dalam pengembangan dan pengelolaan sistem data.3. Sertifikat : Diutamakan memiliki sertifikasi atau pelatihan terkait data engineering dan data analisis",Jakarta Raya,https://www.jobstreet.co.id/id/job/80136749?type=standard&ref=search-standalone
Data Custodian,"PT Allo Bank Indonesia, Tbk","TheData Custodianis responsible for collecting and managing metadata, analyzing data flows and lineage, and refining data element definitions to ensure consistency and clarity across the organization.Key Responsibilities:Collaborate closely with development units and business teams during the Data Discovery process.Collect and document metadata from various available data sources.Analyze and visualize data flows and lineage from existing data sources.Develop and maintain clear and consistent data element definitions across all divisions.Ensure all documentation related to metadata, data flows, lineage, and data definitions is accurate and up to date.Qualifications:Bachelor's degree in Information Systems, Information Technology, or a related field.At least 1 year of experience in data management, particularly in metadata management, ETL, or data analysis.Experience in the banking or financial industry is a plus.Strong understanding of data flow, data lineage, and data transformation concepts.Excellent analytical skills with strong attention to detail.Strong communication skills, with the ability to work independently or within a team.",Jakarta Raya,https://www.jobstreet.co.id/id/job/79551416?type=standard&ref=search-standalone
"Data Analyst, Tokopedia",Bytedance Inc,"About ByteDanceByteDance is a global incubator of platforms at the cutting edge of commerce, content, entertainment and enterprise services - over 2.5bn people interact with ByteDance products including TikTok.Job DescriptionResponsibilitiesAbout ByteDanceFounded in 2012, ByteDance's mission is to inspire creativity and enrich life. With a suite of more than a dozen products, including TikTok as well as platforms specific to the China market, including Toutiao, Douyin, and Xigua, ByteDance has made it easier and more fun for people to connect with, consume, and create content.Why Join UsCreation is the core of ByteDance's purpose. Our products are built to help imaginations thrive. This is doubly true of the teams that make our innovations possible.Together, we inspire creativity and enrich life - a mission we aim towards achieving every day.To us, every challenge, no matter how ambiguous, is an opportunity; to learn, to innovate, and to grow as one team. Status quo? Never. Courage? Always.At ByteDance, we create together and grow together. That's how we drive impact - for ourselves, our company, and the users we serve.Join us.About UsAt TikTok, our Global Business Solutions (GBS) team plays a key role in generating revenue by promoting our advertising solutions, onboarding new clients, driving ad campaigns, and more. As the TikTok community grows at an unprecedented speed around the world, our GBS team leads groundbreaking projects that are changing the landscape of the advertising industry in real time.Responsibilities- Business Analysis and Management: Global Business Solutions business data analysis, develop strategic planning, provide solutions and implementation plans; based on the understanding and analysis of the specific business domains, continuously optimize control rules, product tools and business operations, to provide strong support for the implementation of the strategy- Regular monitoring and data analysis on various business metrics and provide corresponding solutions to assist the GBS team to better serve clients and optimize business opportunities.- Business puzzle breakdown: deeply support sales and client solution team leader to do project task break-down, prioritization, monitoring important business progress; able to measure project output and efficiency through quantitative and qualitative analysisQualificationsMinimum Qualifications- Bachelor's degree in math, statistic or related technical major with strong capability of data analytics is required- 3-5 years of experience in data analytics / engineering positions in e-commerce/ads with strong proficiency in SQL, R/Python for data analysis- Experienced in using common statistical and analytical methods and skills in Data Visualization tools such as Tableau.- Outstanding reasoning capability and logic, with good problem solving methodologies, being able to independently output quality strategic solutions, strong learning and adaptive ability, strategic framework thinking, sensitivity and insight into the business- Strategic thinking capacity, able to quickly understand the business and discover the connection between business and data performance- Excellent verbal and written English communication skills.Preferred Qualifications- Experienced in programming languages such as C, C++, Java, Go, Python, or R- Experienced in custom ETL/data pipeline design, implementation and maintenance.- Experienced with data processing software and algorithmsByteDance is committed to creating an inclusive space where employees are valued for their skills, experiences, and unique perspectives. Our platform connects people from across the globe and so does our workplace. At ByteDance, our mission is to inspire creativity and enrich life. To achieve that goal, we are committed to celebrating our diverse voices and to creating an environment that reflects the many communities we reach. We are passionate about this and hope you are too.",Jakarta Raya,https://www.jobstreet.co.id/id/job/80764375?type=standard&ref=search-standalone
Business Intelligence Intern (Next Level Internship),PT Mid Solusi Nusantara (MEKARI),"Mekari is Indonesia's no. 1 Software-as-a-Service (SaaS) company. Our mission is to empower businesses and professionals to progress effortlessly. Our products (Mekari Talenta, Mekari Jurnal, Mekari KlikPajak, Mekari Qontak, Mekari Flex, & Mekari Sign) have been used by tens of thousands of businesses in Indonesia.To reach millions, we need more people like you: entrepreneurs, builders, owners inside the company who are eager to grow at scale. Join us to empower more businesses with technology.Job Descriptions:Define and implement BI & analytic strategies to uncover actionable insights and opportunities from our existing data.Performs analysis and generates insights and recommendations to support the business/product in decision-making.Improve processes by applying BI best practices.Manage data products and disseminate information.Consulting with internal customers (e.g. Operation, Commercial, Product, etc) to develop analyses that lead to actionable insights.Collect data from multiple sources to create integrated views that can be used to drive decision-making.In charge of the day-to-day analytical requirements, communicating issues, suggesting remedial action and improvements where appropriate.Oversee the execution of strategy recommendations for intelligence/data-driven capacity.Accountable for data integrity and quality, ensuring it is continuously maintained and improved.Develop and update technical documentation as necessary.Requirements/Qualifications:Final year student or fresh graduate in a quantitative discipline such as Computer Science, Engineering, Statistics, or MathematicsAnalytical mindset and ability to see the big picture and influence others.Detail-oriented and must have an aptitude for solving unstructured problems. The role will require the ability to extract data from various sources and to design/construct/execute complex analyses to come up with data/report that help solve the business problem.Familiarity with data warehouse design (e.g. dimensional modeling) and data mining.Familiar with one or more languages for querying (e.g. SQL, PostgreSQL).Familiar with Big Data/Analytics Platforms like R, Phyton is preferred.Familiar with BI tools like Tableau, Looker or similar.Proven abilities to take initiative and be innovative.Analytical mind with a problem-solving aptitude.",Jakarta Raya,https://www.jobstreet.co.id/id/job/77245492?type=standard&ref=search-standalone
Business Intelligence Analyst,PT Moladin Digital Indonesia,"Moladin is Indonesia’s leading used car fintech and marketplace. We are transforming the used car industry by empowering all players using our proprietary operational, financing, AI and IoT capabilities. We target to continue to grow strongly and explore more opportunities in the coming years. As a Tech start-up, we have one of the most seasoned and deep management teams plus have received strong financial backing from top investors including Sequoia Capital, Rocket Internet, East Ventures, Northstar, and DST Global. We have offices based in Indonesia and an office in Singapore. The successful candidate will be responsible for enabling data-driven business decisions by turning complex data into meaningful and easy-to-understand insights. This position offers the opportunity to join an innovative and dynamic team alongside a growing network of dealers and agents.ResponsibilitiesETL, analyze complex data sets and develop relevant reports and dashboards to support company-wide decision-making.Identify data quality and data structure issues, and work with the appropriate stakeholders to address them.Collaborate with internal teams to understand their reporting needs and proactively identify opportunities for analysis.Maintain and improve existing reports and dashboards, and implement new ones.RequirementsMinimum Bachelor’s Degree in Computer Science, Statistics, Mathematics, or in a relevant field with a strong academic track record.Have at least 1 year of professional experience in Business Intelligence or data-related roles.Highly proficient in SQL and familiarity with visualization tools like Looker Studio, Metabase, or Tableau.Strong analytical and problem-solving skills, with the ability to not only identify bugs but also gather insights and interpret complex data sets.Ability to manage multiple priorities in a fast-paced environment.Good communication skills and ability to collaborate effectively with cross-functional teams.Fluent in English.","Kebayoran Lama, Jakarta Raya",https://www.jobstreet.co.id/id/job/73808201?type=standard&ref=search-standalone
Data Steward,Snaphunt,"The OfferOpportunity within a company with a solid track record of performanceFlexible working optionsAttractive Salary & BenefitsThe JobYou will be responsible for :Key Responsibilities:Engage with clients to facilitate & collect data.Travel to various locations to meet clients and get consent.Be resilient to rejection.The ProfileRequirements:Commitment to working 8 hours a day, 40 hours a week.Willingness to travel as neededPrevious experience in sales is preferred, but not required. A positive attitude and eagerness to learn are essential!Strong communication skills and the ability to connect with diverse individuals.Compensation:Competitive pay in USD, with lucrative commission opportunities based on performance.The EmployerOur client is a leader in cloud-based software for the global life sciences industry. Committed to innovation, product excellence, and customer success, Our client has more than 875 customers, ranging from the world's largest pharmaceutical companies to emerging biotechs.",Jakarta Raya,https://www.jobstreet.co.id/id/job/80523821?type=standard&ref=search-standalone
Data Security and Privacy Officer,PT Mid Solusi Nusantara (MEKARI),"Job DescriptionIn collaboration with related teams, develop and maintain data flow diagrams, data catalog, and all other relevant metadata for data security and privacy.Exercise supervision and control of data management life cycle, including but not limited toApply policy, standard, and guideline concerning data managementVerify and escalate issues concerning policy, standard, and guideline of data managementTrack changes to organization relevant for data management practice and update policy, guideline, and standardManage and implement projects concerning data security & privacy protection anonymization/pseudonymization, encryption/hashing, least privileged/privileged access, and others.Develop and maintain automation necessary to support and monitor data management practice.RequirementsFair command of active and passive englishStrong logical thinking to apply policy, guideline, standard, and potentially revealStrong foundational technical knowledge to assess data security and privacy.Good skills in basic scripting and automation skills are mandatory.",Jakarta Raya,https://www.jobstreet.co.id/id/job/76146987?type=standard&ref=search-standalone
Data Security and Privacy Officer,PT Mid Solusi Nusantara (MEKARI),"Mekari is Indonesia's no. 1 Software-as-a-Service (SaaS) company. With our ecosystem of software solutions—including Mekari Jurnal, Mekari Talenta, Mekari Qontak, and Mekari Flex, we aim to facilitate entrepreneurs and leaders as they accelerate the digital transformation of their businesses.In our 10+ years of journey we have reached over 1 Million platform users, and we're not planning to stop any time soon. We need more people like you: builders and owners with calculated ambition who are eager to grow and create their #BiggestImpact.Job DescriptionIn collaboration with related teams, develop and maintain data flow diagrams, data catalog, and all other relevant metadata for data security and privacy.Exercise supervision and control of data management life cycle, including but not limited toApply policy, standard, and guideline concerning data managementVerify and escalate issues concerning policy, standard, and guideline of data managementTrack changes to organization relevant for data management practice and update policy, guideline, and standardManage and implement projects concerning data security & privacy protection anonymization/pseudonymization, encryption/hashing, least privileged/privileged access, and others.Develop and maintain automation necessary to support and monitor data management practice.RequirementsFair command of active and passive englishStrong logical thinking to apply policy, guideline, standard, and potentially revealStrong foundational technical knowledge to assess data security and privacy.Good skills in basic scripting and automation skills are mandatory.Our team will review your application and will be in touch if your application is shortlisted to the next stage. If you do not hear from us in 30 days, we will keep your resume on file in case a relevant opportunity opens up.Don't forget to check our Recruitment FAQ at bit.ly/RecruitmentFAQ-Mekari [ENG] or bit.ly/RekrutmenMekari-FAQ [INA] to find the answers to commonly-asked questions regarding our recruitment process.We wish you the best. Hope to see you around soon!",Jakarta Raya,https://www.jobstreet.co.id/id/job/79686682?type=standard&ref=search-standalone
Data Migration,PT. SIGMA GLOBAL TEKNOLOGI (SIGMATECH),"Jobdesk:'- Oversee and manage the overall workplan of data migration workstream- Provide direction and guidance to all team members- Perform data migration planning and alignment to overall timeline- Ensure milestones and deadlines are met- Act as a primary contact between stakeholders and migration team- Coordinate between business units, IT, and vendor teams for migration activities- Point of escalation and manage risks and issues for data migration*notes: there should be the peer for Data Migration Lead from  core banking vendor side.",Jakarta Raya,https://www.jobstreet.co.id/id/job/80362633?type=standard&ref=search-standalone
